hotel_name,hotel_address,hotel_distance_center,hotel_room,hotel_star,hotel_score,hotel_score_title,hotel_number_reviews,hotel_price,hotel_offer
Heritage Line - Jasmine Cruise,"20.91951501379,106.985549926758",,Deluxe Double or Twin Room with Balcony - 2 Days 1 Night,4 out of 5,9.3,Superb,11 reviews,"VND 7,577,160",All meals included
Annie Art House Ha Long - 1BR,"20.9584812190278,107.007069676735",,One-Bedroom Apartment,,,,,"VND 800,000",
Khách sạn Duy Anh Hạ Long,"20.964384,107.048038",,Twin Room with City View,1 out of 5,,,,"VND 800,000","FREE cancellation,• No prepayment needed"
Athena Royal Cruise,"20.9468998710103,107.084805818848",,Executive Suite with Private Balcony - 2 Days 1 Night,5 out of 5,9.4,Superb,104 reviews,"VND 19,600,894",All meals included
Huong Hai Sealife Cruise,"20.9467212483614,107.029860019684",,Suite Private Balcony 3D2N Package (7 Meals),4 out of 5,9.6,Exceptional,163 reviews,"VND 11,143,500",All meals included
Imperial Cruise - Managed by Royal Palace Cruise,"20.9173744009643,106.989547897842",,Twin Room - 2 Days 1 Night,3 out of 5,8.9,Fabulous,74 reviews,"VND 7,736,400",All meals included
POSEIDON HOTEL,"20.96015,106.994471",,Budget Double or Twin Room,2 out of 5,,,,"VND 400,000",
Bhaya Halong Cruises,"20.9229824550511,106.990034580231",,Deluxe Room with Sea View - 2 Days 1 Night,5 out of 5,9.3,Superb,124 reviews,"VND 8,939,737",All meals included
Signature Royal Halong Cruise,"20.953256474353,107.069020294392",,Junior Suite with Jacuzzi - 2 Days 1 Night,5 out of 5,9.3,Superb,261 reviews,"VND 16,437,393",All meals included
MOONLIGHT HOMESTAY,"20.947485493537,107.074085311535",,Apartment,,,,,"VND 3,540,000",Breakfast included
ITAS HOMESTAY,"20.9579875,107.0071996",,Three-Bedroom Apartment,,,,,"VND 1,200,000",
Minh Đức Hotel,"20.957677,107.000799",,Twin Room with View,,,,,"VND 300,000",
Aloha FLC Hạ Long,"20.9529685,107.111662",,Villa,,,,,"VND 9,600,000",
Chung Cư Newlife Tower,"20.951620428251,107.024504989078",,One-Bedroom Apartment,,,,,"VND 1,260,000",
Maya Homestay Hạ Long,"20.95122764101,107.070754528294",,Two-Bedroom Apartment,,,,,"VND 1,250,000",
Căn hộ 5 phòng ngủ tại Bãi Cháy Hạ Long cách bãi biển 300m,"20.9581638,107.0511539",,Apartment,,,,,"VND 2,599,000",
CatBa Backpacker Hostel,"20.7266934798205,107.046676751015",,Bunk Bed in Mixed Dormitory Room,,8.9,Fabulous,98 reviews,"VND 171,000",
La Casa Homestay and Coffee,"20.958574,107.050522",,Twin Room with Balcony,,,,,"VND 760,000",
Halong Paloma Cruise,"20.955782,107.068024",,Deluxe Ocean View Double/Twin Cabin - 2 Days 1 Night,4 out of 5,9.2,Superb,325 reviews,"VND 8,775,000",All meals included
